{
  "thread_version":1,
  "submission_id":"34584",
  "author_id":"author-coordinator",
  "review": {
    "version":1,"reviewer_id":"reviewer-r2","summary":"The submission develops order-equivariant neural networks on poset-indexed feature bundles, characterizes linear layers, and gives universal-approximation constructions with graph, sheaf, and multimodal examples.","strengths":[{"text":"The transporter-law characterization gives a concrete parameterization of equivariant linear maps.","anchors":["THM-0001"]},{"text":"The hierarchy distinguishes anonymous message passing from source-labeled pair-state models.","anchors":["TXT-0061"]}],"weaknesses":[{"id":"reviewer-r2-W1","text":"The empirical comparison is too narrow to establish the broad practical benefit claimed for the framework.","severity":"major","affected_claims":["CLAIM-008","CLAIM-009"],"anchors":["TXT-0264","TAB-0004"]}],"scores":{"soundness":3,"presentation":3,"significance":2,"originality":3,"overall":3},"key_questions":[{"id":"reviewer-r2-Q1","question":"How stable is the reported empirical gain across seeds and matched-capacity baselines?","possible_score_impact":"A robust comparison could raise Significance and Overall by one point."}],"limitations":"The review did not independently execute code or formalize the universal-approximation proofs.","confidence":4,"ethical_concerns":[],"evidence_refs":["TXT-0264","TAB-0004"]
  },
  "rebuttal": {
    "version":1,"reviewer_id":"reviewer-r2","official_review_version":1,"responses":[{"concern_id":"reviewer-r2-W1","response_label":"limitation_acknowledged","response":"We agree that the submitted empirical evidence is narrow. Table 2 reports one EMG-IMU comparison against TemporalCNN and InvariantTransformer; the submission does not provide multi-seed dispersion, matched-capacity sweeps, or distribution-shift tests. We therefore limit the empirical conclusion to the reported setup and do not claim broader practical robustness from this experiment.","evidence_refs":["TXT-0264","TAB-0004","TXT-0281"]},{"concern_id":"reviewer-r2-Q1","response_label":"cannot_answer_without_new_research","response":"The submitted materials contain no per-seed runs or matched-capacity baseline sweep. Quantifying stability across those axes requires new experiments, so we cannot supply or claim that result in rebuttal.","evidence_refs":["TXT-0264","TAB-0004"]}],"evidence_refs":["TXT-0264","TAB-0004","TXT-0281"],"commitments":["will:narrow the empirical generalization claim to the reported setup","will:clarify Table 2 is a single reported setup"],"limitations_acknowledged":["The submission does not establish seed stability, matched-capacity baseline fairness, or distribution-shift robustness for the reported empirical gain."],"published_at":"2026-07-11T15:00:00Z"
  },
  "reviewer_followup": {
    "version":1,"reviewer_id":"reviewer-r2","official_review_version":1,"rebuttal_version":1,"concern_resolutions":[{"concern_id":"reviewer-r2-W1","resolution":"partially_resolved","response_evidence":["rebuttal:reviewer-r2-W1"],"remaining_gap":"No multi-seed or matched-capacity experiment is available."}],"scores":{"soundness":3,"presentation":3,"significance":2,"originality":3,"overall":3},"confidence":4,"score_change_rationale":"The response appropriately narrows the claim but provides no new empirical evidence, so the significance and overall scores remain unchanged.","new_questions":["Will the final text explicitly limit the generalization claim to the reported EMG-IMU setup?"],"summary":"The rebuttal is truthful and partially addresses the breadth concern by narrowing the claim; empirical robustness remains unresolved.","evidence_refs":["rebuttal:reviewer-r2-W1","TXT-0264","TAB-0004"]
  },
  "author_final_followup": {
    "version":1,"reviewer_id":"reviewer-r2","reviewer_followup_version":1,"prior_rebuttal_version":1,"responses":[{"question_id":"reviewer-r2-FQ1","response_label":"planned_revision","response":"Yes. We will revise the empirical discussion to state that Table 2 supports only the reported EMG-IMU setup and does not establish robustness across seeds, matched-capacity baselines, or distribution shifts.","evidence_refs":["TXT-0264","TAB-0004","TXT-0281"]}],"evidence_refs":["TXT-0264","TAB-0004","TXT-0281","rebuttal:reviewer-r2-W1"],"commitments_carried":["will:narrow the empirical generalization claim to the reported setup","will:clarify Table 2 is a single reported setup"],"limitations_carried":["The submission does not establish seed stability, matched-capacity baseline fairness, or distribution-shift robustness for the reported empirical gain."],"published_at":"2026-07-11T16:00:00Z"
  },
  "events":[
    {"sequence_id":1,"event_type":"reviewer.initial_review.published","actor_id":"reviewer-r2","published_at":"2026-07-11T14:00:00Z","artifact_ref":"tests/fixtures/author/34584/reviewer-r2-official-review.json"},
    {"sequence_id":2,"event_type":"author.rebuttal.published","actor_id":"author-coordinator","published_at":"2026-07-11T15:00:00Z","artifact_ref":"tests/fixtures/author/34584/rebuttal-r2.json"},
    {"sequence_id":3,"event_type":"reviewer.followup.published","actor_id":"reviewer-r2","published_at":"2026-07-11T15:30:00Z","artifact_ref":"tests/fixtures/author/34584/reviewer-followup-r2.json"},
    {"sequence_id":4,"event_type":"author.final_followup.published","actor_id":"author-coordinator","published_at":"2026-07-11T16:00:00Z","artifact_ref":"tests/fixtures/author/34584/final-followup-r2.json"}
  ]
}
